{
  "$schema": "https://json-schema.org/draft/2020-12/schema",
  "type": "object",
  "required": ["id", "version", "root", "ownedFiles", "invariants"],
  "properties": {
    "id": {"type": "string", "pattern": "^[a-z0-9-]+$"},
    "version": {"type": "integer", "minimum": 1},
    "root": {"type": "string", "minLength": 1},
    "ownedFiles": {"type": "array", "items": {"type": "string"}, "minItems": 1},
    "invariants": {"type": "array", "items": {"type": "string"}},
    "jsEntry": {"type": ["string", "null"]},
    "dependencies": {"type": "array", "items": {"type": "string"}}
  },
  "additionalProperties": true
}
