{
  "id": "pricing",
  "version": 1,
  "root": "[data-bg-component=\"pricing\"]",
  "ownedFiles": [
    "components/pricing/pricing.html",
    "components/pricing/pricing.css",
    "components/pricing/contract.json"
  ],
  "invariants": [
    "baseline-frisse-blik-pricing-preserved",
    "baseline-pricing-cta-destinations-preserved",
    "adjacent-proof-and-memo-excluded",
    "no-sibling-component-selectors"
  ],
  "jsEntry": null,
  "dependencies": []
}
